Nombre,Localización,Latitud,Longitud,Características,Descripción,Tipo_lugar_turistico,url
Ruta de la Vía de la Plata / Vía Carisa,Lena y Aller,43.10650456846116, -5.741411000580849,"['Distancia:30,3kms', 'Dificultad:Alta', 'Código:GR100 Ruta de la Vía de la Plata - Etapa 6 y 7', 'Altitud:466 m.', 'Desnivel:507 m.', 'A pie:6 h. 30 min.Sólo ida', 'Punto de partida:Pendilla de Arbás (León)', 'Tipo de ruta:senderismo', 'Tipo de recorrido:Travesía', 'Trazado de la ruta:Descargar kml,Descargar gpx']","Pendilla de Arbás (León) - Carabanzo (Lena)30La Carisa fue la primera y principal vía de comunicación romana de Asturias, debiendo su nombre a Publio Carisio, el legado de Octavio Augusto, entre los años 26-22 a. de C., que ordenó su construcción. Este camino por la montaña no es más que un segmento, excepcionalmente llegado hasta nuestros días, de un itinerario mucho más largo. Justificadas razones históricas y geográficas llevan a situar las cabeceras de esta vía en las actuales ciudades de León y Gijón, que en el Imperio alcanzaron categoría urbana.De esta forma enlazaba con las principales vías de comunicación terrestres y marítimas del Imperio.La vía Carisa se puede recorrer a pie o en bicicleta de montaña, ya que su itinerario se encuentra señalizado y homologado como sendero de gran recorrido GR 100 Vía de la Plata/Vía Carisa (Etapa 7: Carabanzo - Pendilla de Arbás).El punto de inicio, en sentido sur-norte, se encuentra en la localidad leonesa de Pendilla de Arbás (municipio de Villamanín), a la que llegaremos siguiendo la N-630 y tomando un desvío, después de pasar Busdongo, en dirección hacia Camplongo de Arbás. Una vez en Pendilla de Arbás nos encontraremos un amplio aparcamiento y el panel informativo del GR, punto desde el que comenzaremos nuestra ruta. Seguiremos en dirección norte por una pista ancha, que nos conduce por la ladera oriental del valle de Pendilla a una altura uniforme hasta llegar al puerto de la collada Propinde, donde asciende hasta 1.800 metros por medio de un sistema de rampas en zigzag en el lugar de Las Retuertas.Después la vía entra en tierras asturianas faldeando el pico Tres Concejos/Tresconceyos (2014 m), que sirve de límite natural entre los municipios asturianos de Lena y Aller, y el leonés de Villamanín, donde se conserva uno de los mejores restos de la plataforma de casi 5 metros de ancho.Durante este recorrido disfrutaremos de unas excepcionales vistas gracias a la altitud por la que transita. Seguimos en camino llano por el cordal de Carraceo, divisoria entre los concejos de Aller y Lena, y visualizaremos unas espectaculares estampas panorámicas del valle de Pajares, situado a la izquierda, y las Ubiñas, de frente.En la Cruz de Fuentes la vía entronca con el camino real y desde aquí se dirige hacia Carabanzo, pasando por el pico la Boya (1.728 m), donde se encuentra el campamento romano de Curriechos/Curriel.los, situado unos 100 metros por encima de la vía Carisa. Se trata de un campamento estacional que llegó a contar con aproximadamente 1,5 km de defensas lineales activas, que exigieron una guarnición de más de 2.000 hombres, y unas 8-9 hectáreas de extensión.Es uno de los asentamientos militares emplazados a mayor altura de toda Hispania y uno de los más altos del Imperio.Desde este punto proseguimos nuestro camino y a penas a 1 km nos encontramos con el cerro del Homón de Faro, donde se hallaron unas fortificaciones erigidas entre los siglos VII y VIII, que probablemente fueron construidas para contener la invasión musulmana, y con el Cantu Busián, lugar donde la línea defensiva remataba en una torre de planta cuadrada.Seguimos avanzando y pasamos por la majada Busián, La Cava y más adelante el camino se bifurca en dos, una variante va hacia el este por la collada el Acíu (1.460 m), donde la vía conecta con la pista que sube desde Nembra, en la vertiente allerana, y la otra por el oeste por Brañarredonda, vertiente de Lena y ruta original.Seguimos en dirección hacia Brañarredonda, itinerario desde donde visualizamos el Mayáu Carboneo, ya en el pueblo de Congostinas. Las dos opciones confluyen en el mayéu (majada) Carraceo. Continuamos por el cordal para llegar al mayéu (majada) Espines, a 1.100 m de altitud, y seguir hacia el collado de Las Cruces, para finalizar en la localidad de Carabanzo (Lena), después de haber recorrido los casi 30 km de esta ruta.LaVía Carisay el ramal transmontano de la Ruta de la Plata, así como los yacimientos arqueológicos del Pico Chagüezos, Monte Curriechos y El Homón de Faro (en los concejos de Lena y Aller), han sido declaradosBien de Interés Cultural, con la categoría de vía histórica, en octubre del año 2017 (Decreto 68/2017).",Ruta,https://www.turismoasturias.es/descubre/naturaleza/rutas/senderismo/cordal-de-la-carisa
Ruta de Lamuño a la Concha de Artedo,Cudillero,43.56035399256834, -6.200084845986117,"['Distancia:10,4kms', 'Dificultad:Baja', 'Altitud:172 m.', 'Desnivel:177 m.', 'A pie:3 h. 15 min.', 'Punto de partida:Lamuño', 'Tipo de ruta:Senderismo', 'Tipo de recorrido:Circular', 'Trazado de la ruta:Descargar kml,Descargar gpx']","Tranquilidad es lo que nos transmite esta ruta desde el mismo momento de comenzar, en la plaza de Lamuño. Una ruta de mar y de montaña, pero sin grandes desniveles, que transcurre entre la abrupta costa de Cudillero y el valle de las Luiñas: una mirada al mar y otra a la zona de montaña del municipio.Podemos disfrutar de la gran área recreativa en el pinar, del paseo entre robles y castaños, de las vistas de los acantilados, del pueblo de Artedo, o del de San Martín de Luiña, donde los vaqueiros de alzada (pastores trashumantes, que se movían en verano a las brañas con su ganado) se veían relegados a la parte trasera de la iglesia durante la misa, como así lo atestigua una inscripción en el suelo del templo.Pero, sin duda, las joyas de la ruta son la preciosa playa de Oleiros, de rocas, y la de La Concha de Artedo, con su laguna detrás, cuya agua se cuela entre las piedras que la forman para salir al mar. La aliseda pantanosa que la ruta atraviesa por una pasarela de madera en la parte de atrás de esta playa es su principal valor natural.",Ruta,https://www.turismoasturias.es/descubre/naturaleza/rutas/senderismo/lamuno-oleiros-la-concha
Ruta de las Brañas Vaqueiras en Cudillero,Cudillero,43.52038427663368, -6.220032395219868,"['Distancia:23,9kms', 'Dificultad:Media', 'Código:PR272', 'Altitud:673 m.', 'Desnivel:787 m.', 'A pie:6 h.', 'Punto de partida:Iglesia de San Martín de Luiña', 'Tipo de ruta:senderismo', 'Tipo de recorrido:Circular', 'Trazado de la ruta:Descargar kml']","Iglesia de San Martín de Luiña - Iglesia de San Martín de Luiña24La ruta recorre varias de las antiguas brañas vaqueiras del concejo de Cudillero, algunas todavía en uso.  Atraviesa bosques autóctonos y no es inusual encontrar en su transcurso corzos, jabalíes y otros representantes de la fauna local…Hay varias alternativas para hacer la ruta, la principal es circular y son unos 24 kilómetros.Se inicia junto a la iglesia de San Martín de Luiña, para después salir hacia el barrio de Castañedo y Mumayor, bajando hacia el río Uncín, en las proximidades de Artedo por el denominado Valle de la Barca.Pasado el río se inicia una suave subida por las faldas de la sierra de Argoma y Pascual. Según vamos ganando altura se empiezan a divisar todos los núcleos del concejo: Faro Vidio, San Martín de Luiña, Lamuño, Salamir, Soto de Luiña, Pramaro, Oviñana…También se puede acceder por el núcleo de Artedo existiendo la posibilidad de acceder al pico L'Abedul y contemplar una amplia perspectiva del concejo, para después continuar hacia una pista que nos viene de poblado de Villaerín y unirse después con la pista principal en la zona de la Xunglosa, donde podemos continuar por las faldas del Llan de Cubel o regresar a San Martín por una pista que nos lleva en fuerte bajada al poblado de Gallinero.Un km más delante del Llan de Cubel, la ruta puede acortarse desviándose y accediendo por un sendero peatonal hacia Teixidiello una de las brañas más altas de esta sierra, y desde allí volviendo hacia San Martín, pasando por las brañas de Folgueirúa, La Puerca, Gallinero y L'Eireo.Si decidimos continuar por el PR unos km más adelante llegamos a la zona de La Bordinga giramos a la derecha y volvemos a las zonas de Teixidiello o la Xunglosa. Si tenemos fuerzas continuamos hacia Brañaseca y Busfrio por la sierra del Pumar, aunque deberemos retroceder si no tenemos un vehículo en las proximidades, por lo que nos llevaría cerca de 30 km entre ida y vuelta dependiendo la opción que queramos realizar de regreso.Textos: Club Deportivo Peña La Chiruca",Ruta,https://www.turismoasturias.es/descubre/naturaleza/rutas/senderismo/ruta-de-las-branas-vaqueiras-en-cudillero
Ruta de las Cascadas de Oneta,Villayón,43.47137688805444, -6.683448107892819,"['Distancia:1,5kms', 'Dificultad:Baja', 'Código:SL5', 'Altitud:325 m.', 'Desnivel:103 m.', 'A pie:1 h.Ida y vuelta', 'Punto de partida:Oneta', 'Tipo de ruta:Senderismo', 'Tipo de recorrido:Ida y vuelta', 'Trazado de la ruta:Descargar kml,Descargar gpx']","El agua, fuente de vida, nos llama poderosamente la atención, nos atrae, y más cuando por la climatología o por la orografía nos muestra toda su fuerza y poder y se convierte en belleza. Esto es lo que nos enseñan las cascadas de Oneta, al menos dos de las tres existentes.Desde el pueblo de Oneta, y en un brevísimo paseo por tierras de prados, llegaremos a la parte alta de la primera, donde el río ha excavado en la roca un canal en el que se cuela hasta llegar al borde del precipicio, por donde se lanza abajo.Dando un pequeño rodeo podemos ver la cola, de unos veinte metros de altura, blanca, estruendosa, bella, en medio del bosque. Poco más abajo, un antiguo molino. Seguimos caminando y llegamos a la segunda, aún más recogida si cabe, algo más abierta, metida entre más vegetación e igualmente bella. Entremedias, un paseo por el interior del bosque, donde en primavera destacan los diferentes narcisos que llenan de amarillo el paseo.",Ruta,https://www.turismoasturias.es/descubre/naturaleza/rutas/senderismo/cascadas-de-oneta
Ruta de Las Fuentes,Aller,43.13831639584943, -5.695089999816469,"['Distancia:13,7kms', 'Dificultad:Media', 'Código:PR133', 'Altitud:780 m.', 'Desnivel:907 m.', 'A pie:5 h.Sólo ida', 'Punto de partida:Santibanes de Murias', 'Tipo de ruta:senderismo', 'Tipo de recorrido:Ida y vuelta', 'Trazado de la ruta:Descargar kml,Descargar gpx']","Santibanes de Murias - Morea/Moreda15,600Partimos de la localidad de Santibanes de Murias, desde el área recreativa situada al lado de La Calera, en dirección a la carretera general y muy pronto encontramos una pista a la derecha por la que nos tenemos que desviar. Continuamos por el camino que nos conduce a la aldea de Vil.lar, desde donde seguimos por la carretera, descendiendo hasta llegar a una bifurcación en la que tenemos que desviarnos a la derecha por el camino real.Este nos vuelve a llevar a la carretera general, por la que transitaremos durante un corto trayecto, hasta tomar el camino a la derecha que nos conduce a la población de Murias. Salimos de esta localidad por su parte alta, continuando por un sendero que atraviesa la ladera sin demasiada pendiente, llegando muy pronto a Arnizo. A partir de aquí, comenzamos una suave subida que finaliza en La Vara, desde donde descendemos hasta Los Corros.Continuamos hasta alcanzar El Cabanón y, sin desviarnos del camino, proseguimos hasta llegar a las aldeas de El Carbayiru y posteriormente a Güertomuro. Seguimos en dirección Oeste y enseguida llegamos a Les Fureres y El Pasaúriu. Proseguimos hasta Pedreo y, después de cruzar esta localidad, el camino nos lleva a Güeria. Sin apenas desnivel, en poco tiempo llegamos a Moreda, el punto final de la ruta.ACCESOS:El inicio de ruta está situado en la localidad de Santibanes de Murias, a la cual se accede por la carretera AE-3 que parte desde Morea/Moreda.",Ruta,https://www.turismoasturias.es/descubre/naturaleza/rutas/senderismo/ruta-les-fuentes
Ruta de Las Xanas,Santo Adriano y Quirós,43.26980267756148, -5.982238053672725,"['Distancia:3,8kms', 'Dificultad:Baja', 'Altitud:551 m.', 'Desnivel:358 m.', 'A pie:1 h. 30 min.Sólo ida', 'Punto de partida:Área Recreativa del Molín de Las Xanas', 'Tipo de ruta:senderismo', 'Tipo de recorrido:Ida y vuelta', 'Trazado de la ruta:Descargar kml,Descargar gpx']","Una de las rutas más conocidas de Asturias, y no es para menos. Este desfiladero abierto en la roca por el arroyo de Las Xanas es un espectáculo para la vista y para la cámara. En él podemos descubrir, si nos fijamos bien, estalactitas de antiguas cuevas abiertas en la caliza y que el río cortó dejándolas al descubierto.En el fondo del valle, bajo nuestros pies, se desarrolla un bosque de ribera típico del que sólo vemos las copas desde el aire; encima, en las zonas donde la caliza casi no tiene tierra, en sus grietas, son las encinas las que sobreviven a duras penas.La minería del hierro nos dejó en la zona su huella en una antigua mina cuya boca encontramos en plena ruta. Según ascendemos vamos dejando atrás la garganta, para introducirnos en el bosque, primero, y en los verdes pastos, después, que culminarán junto a la iglesia de Pedroveya, donde sentarnos a comer el bocadillo si no tenemos mesa reservada en el pueblo y a disfrutar de un paisaje idílico.",Ruta,https://www.turismoasturias.es/descubre/naturaleza/rutas/senderismo/ruta-de-las-xanas
Ruta de los Bosques de Villanueva de Oscos,Villanueva de Oscos,43.304598312825, -6.9945866754279,"['Distancia:6,2kms', 'Dificultad:Baja', 'Altitud:744 m.', 'Desnivel:141 m.', 'A pie:1 h. 30 min.', 'Punto de partida:Vilanova/Villanueva de Oscos', 'Tipo de ruta:Senderismo', 'Tipo de recorrido:Circular', 'Trazado de la ruta:Descargar kml,Descargar gpx']","En la plaza del pueblo, frente al monasterio cisterciense y un hórreo de pizarra, comienza nuestra ruta, que nos va a llevar por valles y bosques en zonas altas o cruzando el río. Disfrutaremos de un paisaje de lo más variado con el que se entremezcla la etnografía para explicarnos la vida en la zona y también el propio paisaje.El valle moldeado por el río tiene una zona inferior fértil donde se asientan la ferrería y el Ecomuseo del Pan, y unas laderas salpicadas cuándo por bosque mixto, cuándo por matorrales de brezal tojal que les dan color.Podemos respirar tranquilos caminando por estos bosques al ver los líquenes, que, colgando de los árboles, nos indican la pureza del aire que entra en nuestros pulmones. Una manera perfecta de conocer parte del concejo de Villanueva de Oscos.",Ruta,https://www.turismoasturias.es/descubre/naturaleza/rutas/senderismo/ruta-de-los-bosques-de-villanueva-de-oscos
Ruta de los Castros,Boal,43.31040781639623, -5.547399902260785,"['Distancia:16,4kms', 'Dificultad:Baja', 'Código:PR249', 'Altitud:730 m.', 'Desnivel:593 m.', 'A pie:5 h. 45 min.', 'Punto de partida:Los Mazos', 'Tipo de ruta:Senderismo', 'Tipo de recorrido:Circular', 'Trazado de la ruta:Descargar kml,Descargar gpx']","Comenzar una ruta en la Casa de la Miel ya promete. A pesar de los avances tecnológicos, se trata de una actividad ancestral muy ligada a la zona que ha avanzado en materiales, pero que mantiene su esencia. Quién sabe cuánto tiempo lleva aquí y si se dedicarían a ella los habitantes de los castros de la zona.En esta ruta podemos perdernos en el tiempo caminando por sus bosques de castaños, bajo la atenta mirada de las ardillas, los picapinos o las asustadizas lagartijas serranas. Nuestros sentidos se deleitan con los sonidos, los olores y los colores que nos brindan estos bosques.Pero donde el tiempo se detiene es en las alturas del Penácaros, con sus vistas sobre el valle del Navia, y, fundamentalmente, en los túmulos funerarios que encontramos en esta zona, y máxime en el castro de Pendia, con los restos de sus cabañas, de sus murallas y, sobre todo, de su sauna. Unos avanzados a sus tiempos.",Ruta,https://www.turismoasturias.es/descubre/naturaleza/rutas/senderismo/ruta-de-los-castros
Ruta de los entornos de Grandas,Grandas de Salime,43.228978039696813, -6.880518989637494,"['Distancia:11,1kms', 'Dificultad:Media', 'Código:PR108', 'Altitud:725 m.', 'Desnivel:171 m.', 'A pie:3 h.', 'Punto de partida:Grandas de Salime', 'Tipo de ruta:Senderismo', 'Tipo de recorrido:Circular', 'Trazado de la ruta:Descargar kml,Descargar gpx']","Hablar de Grandas de Salime es hacerlo de etnografía y de su embalse. Recorrer los entornos de Grandas de Salime nos transporta a paisajes abiertos de suaves colinas en algunas zonas y de grandes laderas en el entorno del embalse, cuya vista lejana nos encontramos al salir de los bosques y las plantaciones de pino.En una red de caminos forestales y pequeñas carreteras vamos rodeando la villa de Grandas recorriendo la zona más rural, donde las cabayeras, los corzos, los jabalíes y los pájaros carpinteros se hacen patentes mediante sus huellas, sus sonidos, sus nidos o sus hozaduras en el terreno.Por la zona más alta vemos Grandas de Salime, con el valle del embalse al fondo y las laderas que bajan del vecino Allande plagadas de pinos y castaños. Una ruta en la que lo rural domina; un paseo sencillo para acabar nuevamente en Grandas, donde visitaremos su colegiata y, sin duda alguna, el museo etnográfico, una joya de la cultura asturiana.",Ruta,https://www.turismoasturias.es/descubre/naturaleza/rutas/senderismo/ruta-de-los-entornos-de-grandas
Ruta de los Lagos,Somiedo,43.05868933133547, -6.150032177446909,"['Distancia:14,7kms', 'Dificultad:Baja', 'Código:PR15', 'Altitud:1.755 m.', 'Desnivel:690 m.', 'A pie:5 h. 30 min.Ida y vuelta', 'Punto de partida:Alto de la Farrapona', 'Tipo de ruta:senderismo', 'Tipo de recorrido:Ida y vuelta', 'Trazado de la ruta:Descargar kml,Descargar gpx']","Alto de La Farrapona - Lagos de Saliencia - Valle del Lago14Iniciamos la ruta en el Alto de la Farrapona en Somiedo, al que accedemos por la AS-15, dirección a Cangas del Narcea, al llegar a Samartín tomamos la AS-227 dirección a Pola de Somiedo y tras pasar La Riera tomar en cuanto sea posible la SD-1 hasta Saliencia para finalmente enlazar con la SO-2 hasta el Alto.Una vez allí cogemos una pista descendente, desde la que vemos una bella panorámica de la parte alta del Valle de Saliencia, llegando al lago de La Cueva, de aguas coloreadas por los vertidos de la explotación minera que hubo en sus alrededores.Seguimos por la pista de la mina, con una fuerte subida hasta pasar junto a la laguna de la Mina -seca en los meses de verano. Al poco vemos la pradera de Cerveriz y el lago del mismo nombre a la izquierda. Al fondo se divisan los Albos (2.109 m.).Volvemos sobre nuestros pasos y continuamos hacia las Vegas de Camayor dejando el lago Cerveriz a nuestra izquierda. Al llegar a una cabaña podemos subir a un collado desde donde se continúa a media ladera hasta contemplar el Lago del Valle.Regresamos a la cabaña, seguimos por la vega de Cerveriz en dirección NO hasta una pista que en ligera subida, conduce a un collado situado al norte. Desde allí divisamos la Vega de Camayor, con pequeñas lagunas.Continuamos en la misma dirección hasta la Llomba de Camayor, desde donde se vemos las crestas de Peña Llana, Cebolléu y Picos Albos. Al final de la vega se encuentra una gran peña donde la ruta gira a la izquierda e inicia un ligero descenso hasta dar vista en poco tiempo al Lago del Valle, el lago más profundo de Asturias.Volvemos por donde hemos venido hasta el final del lago Cerveriz para ascender un poco y divisar el lago la Calabazosa o lago Negro. Descendemos hacia el lago bordeándolo por su derecha, y tras un ligero ascenso, contemplamos el Lago la Cueva. Lo bordeamos a media ladera y descendemos en busca de la pista que nos llevará a la Farrapona.",Ruta,https://www.turismoasturias.es/descubre/naturaleza/rutas/senderismo/ruta-de-los-lagos-de-saliencia
Ruta de Los Lagos (Covadonga),Cangas de Onís,43.27088979568984, -4.988563999249457,"['Distancia:6,2kms', 'Dificultad:Baja', 'Código:PR221/PNPE2', 'Altitud:1.202 m.', 'Desnivel:50 m.', 'A pie:2 h. 30 min.', 'Punto de partida:Aparcamiento de Buferrera', 'Tipo de ruta:senderismo', 'Tipo de recorrido:Circular', 'Trazado de la ruta:Descargar kml,Descargar gpx']","Aparcamiento de Buferrera - Aparcamiento de Buferrera5Los Lagos de Covadonga, en el corazón de los Picos de Europa, son uno de esos lugares que no podéis perderos viajando por Asturias. Uno de esos escenarios mágicos, que cuentan además con la posibilidad de hacer una ruta circular en su entorno, que es una de las más populares del Paraíso Natural.Esta ruta es la PR-PNPE-2, según la nomenclatura oficial de este sendero en el Parque Nacional de los Picos de Europa. En ella recorreréis una distancia de cinco kilómetros, en aproximadamente dos horas y media, siendo el nivel de dificultad considerado como bajo.Se trata de una ruta que, al ser circular, puede hacerse en el sentido de las agujas del reloj, o en el contrario. Lo más habitual suele ser iniciarla en el parking de Buferrera, que es la zona de aparcamiento más amplio, aunque también podéis comenzar un poco más arriba, en el parking del Lago Ercina.Desde el aparcameinto de Buferrera parten unas pasarelas de madera peatonales, que suben hasta el Centro de Visitantes Pedro Pidal (si camináis en el sentido de las agujas del reloj) o bien hacia el Lago Enol (en sentido contrario), en paralelo a la carretera. Si optáis por la primera posibilidad, tras el centro de visitantes, lo mejor es que os acerquéis primero al Mirador del Príncipe de Asturias, y luego bajéis a las Minas de Buferrera, donde se conserva un túnel (no abierto al público) que atestigua el pasado minero de esta zona.De aquí podéis ir la Mirador de Entrelagos, desde donde tendréis unas magníficas vistas del Lago Ercina por un lado, y el Lago Enol, por el otro. Será este último hacia el que os encaminaréis. Pero previamente, conectaréis con el lago de La Ercina, más o menos por su mitad, para adentraros en el lago conocido como El Bricial y el bosque Palomberu, para llegar después a la vega de Enol, donde encontraréis la ermita del Buen Pastor y el refugio. Una vez allí bordearéis por un agradable sendero este lago, y luego ya directos al aparcameinto.¡Habrá sido un tranquilo paseo entre vacas, lagos y bosques!",Ruta,https://www.turismoasturias.es/descubre/naturaleza/rutas/senderismo/ruta-de-los-lagos-covadonga-
Ruta de los Lanceros,Las Regueras,43.385835466906, -5.9669124986976,"['Distancia:14,6kms', 'Dificultad:Media', 'Código:PR172', 'Altitud:250', 'Desnivel:179 m.', 'A pie:3 h. 30 min.', 'Punto de partida:Iglesia de San Pedro del Nora', 'Tipo de ruta:Senderismo', 'Tipo de recorrido:Circular', 'Trazado de la ruta:Descargar kml,Descargar gpx']","Cuenta la historia que, cuando Enrique de Trastámara llegó a la zona escapando de Pedro I el Cruel, siete nobles de la zona lo apoyaron, y de ahí las siete lanzas que lo protegieron y el nombre de la ruta.Se trata de un recorrido por Las Regueras, por zona de casonas, partiendo y terminando en la bella iglesia prerrománica de San Pedro del Nora. Entremedias, un mosaico de paisajes, donde el ser humano tiene mucho que ver, en los huertos, las fincas de pasto, las de siega, las grandes plantaciones de maíz para el ganado, pero también en los bosques de encinas atlánticas, frecuentes en la zona central del recorrido, allí donde abundan las calizas desnudas.No faltan los castaños de variedad valduna, tan apreciados por el fruto; pero, sin lugar a dudas, el gran protagonista del itinerario es el río Nora y sus grandes meandros, adornados por los bosques de ribera, las saucedas que dan personalidad propia a las orillas, incluso en pleno invierno.",Ruta,https://www.turismoasturias.es/descubre/naturaleza/rutas/senderismo/ruta-de-los-lanzeros
