Nombre,Localización,Latitud,Longitud,Características,Descripción,Tipo_lugar_turistico,url
Ruta El Gumial,Aller,43.07397176375679, -5.450818496265846,"['Distancia:9kms', 'Dificultad:Media', 'Código:PR48', 'Altitud:1.625 m.', 'Desnivel:365 m.', 'A pie:4 h.Ida y vuelta', 'Punto de partida:El Fielato', 'Tipo de ruta:senderismo', 'Tipo de recorrido:Ida y vuelta', 'Trazado de la ruta:Descargar kml,Descargar gpx']","El Fielato - Cuevas9,5El itinerario comienza en El Fielato, un conjunto de cabañas situadas en el Puerto de San Isidro, en el margen derecho de la carretera AS-112.Desde aquí nos dirigimos hacia el cauce del río Braña, que cruzaremos siguiendo las señales del sendero, e iniciamos una leve subida que nos lleva a Brañarreonda.En este lugar encontramos una fuente, desde la cual parte el sendero que nos conduce en ascenso a la La Coḷḷá Beldoso. El camino prosigue escorándose a la izquierda de la collada, pasando sobre el bosque de hayas centenarias conocido como Monte'l Tuzu.El paso por un piornal y un pedrero nos conduce a la majada de Fuentes de Baxo y a la recóndita braña de El Gumial. Tras pasar este último punto, pronto nos encontramos sumergidos en el bosque que da nombre a la ruta: El Gumial. Un bosque de hayas con un encanto especial, en el que no es difícil imaginarse la existencia de seres mitológicos, siempre acompañados por el rumor del agua del río Alba.A partir de aquí, descendemos continuadamente por una pista dejando a nuestro paso el agrupamiento de cabañas denominado La Yana. Pronto llegamos al fondo del valle por el que discurre el río Braña, que tendremos que cruzar para coger el camino que baja paralelo a la carretera hasta llegar a Cuevas, punto final del itinerario.ACCESOS:El punto de inicio de la ruta es El Fielato, lugar al que accedemos por la carretera AS-112 Uxo-Puerto de San Isidro.",Ruta,https://www.turismoasturias.es/descubre/naturaleza/rutas/senderismo/el-gumial
Ruta Foz de la Escalada - Tiatordos,Ponga,43.19225347376744, -5.220138544919551,"['Distancia:7,2kms', 'Dificultad:Alta', 'Código:PR304', 'Altitud:1.575 m.', 'Desnivel:1270 m.', 'A pie:8 h.', 'Punto de partida:Taranes', 'Tipo de ruta:senderismo', 'Tipo de recorrido:Ida y vuelta', 'Trazado de la ruta:Descargar kml,Descargar gpx']","Tarañes - Tarañes17Recorrido que rodea el Pico Tiatordos (1951 m) partiendo de una altitud de 571 m. En los primeros 3 km se salva un fortísimo desnivel a través de la Foz de la Escalada y el hayedo de La Bufona.Una vez superada esta subida se abren ante nosotros pastizales de montaña salpicados de piornales, donde se localiza la Mayada de Entregüé con sus cabañas y la Fuente del Cascayu, lugar idóneo para hacer un alto.Desde allí la ruta continúa en dirección sureste hacia la base del Tiatordos donde se encuentra con el PR65, sendero señalizado que asciende desde Pendones (PN de Redes).Desde ese punto es posible coronar la cumbre del Tiatordos por cualquiera de los senderos existentes, pero si seguimos rodeando la montaña iniciaremos el descenso por la ladera sur, dando vista al Cordal de Ponga y la Peña Maciédome.Pronto encontraremos la fuente de Xerús y Brañadosu, sin olvidarnos de la aguja caliza de impresionantes dimensiones conocida como Fuso la Muyer. Atravesando el hayedo de Medio Monte, y una vez superado el collado Forada, daremos vista a la cara este para disfrutar de la sobrecogedora Copa del Tiatordos.Desde aquí el camino se convierte en una pista forestal que, a través de bosques de castaño y algún que otro prado de siega, nos acerca a los pueblos de Abiegos y Tanda, así como al catalogado como castro romano de El Castiellu, para finalizar el recorrido en el pueblo de Tarañes.",Ruta,https://www.turismoasturias.es/descubre/naturaleza/rutas/senderismo/ruta-foz-de-la-escalada-tiatordos
Ruta Frente del Nalón,Candamo,43.4522216246035, -5.999752378347646,"['Distancia:14kms', 'Dificultad:Media', 'Código:PR261', 'Altitud:613 m.', 'Desnivel:568 m.', 'A pie:4 h.Sólo ida', 'Punto de partida:Alto de la Sierra', 'Tipo de ruta:Senderismo', 'Tipo de recorrido:Ida y vuelta', 'Trazado de la ruta:Descargar kml,Descargar kmz']","Quizás una de las huellas más profundas que pueda dejar el ser humano sea la de una guerra, y esta también puede quedar impresa en la naturaleza. Esta ruta nos recuerda la contienda que enfrentó en el siglo pasado a hermanos y los vestigios que nos dejó.Trincheras de cientos de metros, nidos de ametralladoras, pequeños búnkeres, en un total de quince kilómetros, repartidos en tres tramos, desde donde controlaban los valles cercanos.Pinares y matorrales de brezos y tojos ocupan gran parte del paisaje, áreas recreativas donde sentarnos a comer y paisajes abiertos que dominar desde las alturas son algunos de los recursos que nos ofrece esta ruta, en la que podemos disfrutar también del vuelo de algunas aves rapaces.Una ruta que nos da una visión histórica del entorno al tiempo que gozamos con la naturaleza, con las huellas de los corzos, con el paisaje excavado por el agua y con la rica huerta de Candamo, que encontramos cuando vamos llegando a las zonas pobladas.",Ruta,https://www.turismoasturias.es/descubre/naturaleza/rutas/senderismo/ruta-frente-del-nalon
Ruta Hoces del Esva,Tineo y Valdés,43.43303099059326, -6.486243499793184,"['Distancia:6,4kms', 'Dificultad:Media', 'Código:PR1 y PR2', 'Altitud:535 m.', 'Desnivel:665 m.', 'A pie:2 h.', 'Punto de partida:Caeras (Tineo)', 'Tipo de ruta:senderismo', 'Tipo de recorrido:Ida y vuelta', 'Trazado de la ruta:Descargar kml,Descargar gpx']","Considerado por algunos entendidos como el mejor bosque de ribera de toda la Península Ibérica, sin duda el Río Esva es un lugar maravilloso para disfrutar de este tipo de naturaleza y de unas aguas con una gran calidad ambiental, como denota la presencia de la nutria y del mirlo acuático.En el cauce del río la vegetación lo ocupa todo: los helechos reales se hacen patentes en grandes franjas, los alisos casi no dejan calvas y el frescor del bosque y el río se unen para convertir este tramo en una ruta de lo más recomendable durante los rigores del verano.En la zona alta, entre castaños, serbales y brezales, descubrimos también que en otros tiempos ésta fue tierra de osos, como nos indica la presencia de cortines (estructuras circulares de piedra para proteger las abejas de los osos). Sin duda alguna, una de las rutas imprescindibles para conocer este tipo de naturaleza en España.",Ruta,https://www.turismoasturias.es/descubre/naturaleza/rutas/senderismo/ruta-hoces-del-esva
Ruta Las Brañas,Aller,43.10386629601352, -5.470073460763865,"['Distancia:13,4kms', 'Dificultad:Media', 'Código:PR30', 'Altitud:615 m.', 'Desnivel:715 m.', 'A pie:5 h. 30 min.Ida y vuelta', 'Punto de partida:Felechosa', 'Tipo de ruta:senderismo', 'Tipo de recorrido:Ida y vuelta', 'Trazado de la ruta:Descargar kml,Descargar gpx']","Felechosa - La Gamonal - La Foz - El Mayaín - Braña La Felguera - Braña La Valencia - Braña de L'Otero - Las Ordaliegas - Braña La Tabierna - El Pinganón - La Campona - Cel.lero - Los Cuadrazos - Área recreativa Las Moyás (Cuevas)Felechosa - Cuevas13 km 400 mLas Brañas, nombre de la ruta, son lugares situados en la montaña a donde los vaqueros suben su ganado a pastar en época estival, compuestas por pequeñas cabañas y corrales. La ruta comienza en la localidad de Felechosa, justo al lado de la ermita de la Virgen de la Antigua. Desde este punto tomamos el camino que discurre paralelo al arroyo de Fresneo.Comenzamos a ascender paulatinamente hasta llegar a La Gamonal, donde empezamos a observar que el valle se estrecha. La ascensión continúa atravesando los parajes de La Foz y El Mayaín, para llegar en poco tiempo al collado y braña de La Felguera. El camino prosigue en dirección este y pasa por la braña de La Valencia, para posteriormente atravesar las brañas de L'Otero, Las Ordaliegas y La Tabierna, siendo este último el punto más elevado del itinerario.A partir de aquí comienza un descenso continuado, en el que tendremos que franquear, una vez pasada la encrucijada de El Pinganón, el arroyo Cuirgo. Seguimos la ruta atravesando La Campona, la collada de Cel.lero y, finalmente, la braña de Los Cuadrazos. En poco tiempo el sendero desemboca en el fondo del valle, en la localidad de Cuevas, donde encontraremos el área recreativa denominada Las Moyás, punto final de la ruta.Desde este lugar existe la posibilidad de llegar al punto de inicio por el camino que sale desde el puente La Muñeca y discurre paralelo a la carretera AS-112.ACCESOS:La ruta comienza en Felechosa, localidad a la cual se accede por la carretera AS-112 Uxo-Puerto de San Isidro",Ruta,https://www.turismoasturias.es/descubre/naturaleza/rutas/senderismo/ruta-las-branas
Ruta Llamas - Llanos,Aller,43.11047544657758, -5.557720000000195,"['Distancia:6,4kms', 'Dificultad:Media', 'Código:PR264', 'Altitud:932 m.', 'Desnivel:380 m.', 'A pie:3 h.Sólo ida', 'Punto de partida:Ḷḷamas', 'Tipo de ruta:senderismo', 'Tipo de recorrido:Ida y vuelta', 'Trazado de la ruta:Descargar kml,Descargar gpx']","Ḷḷamas - Yanos6,143Esta ruta senderista une los pueblos de Ḷḷamas y Yanos a través de un camino que discurre por la falda del cordal de La Zorra. Partimos de la localidad de Ḷḷamas, donde se encuentra la iglesia románica de San Juan el Real, declarada Bien de Interés Cultural. Su construcción corresponde a los siglos XIII-XIV, aunque su fundación fue anterior a esta fecha. Los protagonistas de este itinerario son el espléndido bosque autóctono, que aparece en numerosas ocasiones a lo largo del camino, y la belleza de las majadas, brañas y caserías que se encuentran en el trayecto.Atravesamos la localidad de Ḷḷamas en dirección este y comenzamos una leve subida por una pista forestal, que nos lleva hasta la majada de La Ḷḷaguna. Continuamos el camino remontando el Quentu Baldumira hasta la majada de El Praón. Proseguimos la ascensión, que nos lleva a pasar por Picolaína, y muy pronto nos encontramos inmersos en el monte Les Porqueres, cuya masa arbórea nos acompaña en el camino.Seguimos hasta llegar a La Forcá y comenzamos a descender continuadamente, pasando por las caserías de La Casa'l Medio y Muries. En este lugar encontramos un cruce de caminos, donde tomaremos el de la izquierda, que nos lleva directamente a Yanos. En poco tiempo contemplamos el cauce del río San Isidro, que cruzaremos por un puente que da acceso a la localidad donde finaliza nuestro itinerario.ACCESOS:El punto de partida de esta ruta se sitúa en Ḷḷamas, localidad a la que se accede por la carretera AE-6 desde Coḷḷanzo.",Ruta,https://www.turismoasturias.es/descubre/naturaleza/rutas/senderismo/ruta-llamas-llanos
Ruta Marinera de Ortiguera,Coaña,43.55955191857786, -6.738124997507862,"['Distancia:3,7kms', 'Dificultad:Baja', 'Código:PR296', 'Altitud:70 m.', 'Desnivel:55 m.', 'A pie:1 h. 15 min.Sólo ida', 'Punto de partida:Ortigueira (Coaña)', 'Tipo de ruta:senderismo', 'Tipo de recorrido:Ida y vuelta', 'Trazado de la ruta:Descargar kml,Descargar gpx']","La ruta marinera de Ortigueira nos descubrirá el paisaje marítimo de la costa occidental de Asturias. Un trazado que recorre el pueblo desde su parte más moderna hasta la más tradicional, pasando por el pequeño puerto pesquero que esconde en su interior. La primera parada será en el faro y la capilla de San Agustín, donde podremos disfrutar de una vista de los confines del mar en el horizonte y de los escarpados acantilados que pueblan la rasa costera de esta área.Más adelante podremos descubrir el pueblo, caminando por sus intrincadas calles en un laberinto de escaleras que deja a la vista los pequeños jardines de las terrazas de las casas más antiguas de la zona, y también el puerto, escondido entre dos acantilados que caen abruptamente hacia el mar, como si fueran cascadas de piedra.Esta ruta nos acerca a un pintoresco pueblecito pesquero, digno de una novela, en el que sus paisajes tienen casi tanto encanto como la gente del lugar.",Ruta,https://www.turismoasturias.es/descubre/naturaleza/rutas/senderismo/ruta-marinera-de-ortiguera
Ruta Mina Carmina,San Martín de Oscos,43.25398603705567, -6.974101500832943,"['Distancia:9,4kms', 'Dificultad:Baja', 'Código:PR280', 'Altitud:863 m.', 'Desnivel:366 m.', 'A pie:2 h. 30 min.', 'Punto de partida:Samartín', 'Tipo de ruta:senderismo', 'Tipo de recorrido:Circular', 'Trazado de la ruta:Descargar kml,Descargar gpx']","Ruta circular que parte desde Samartín ascendiendo hacia el Monte de Marón donde se encuentra la Mina Carmina, desde esta se asciende al pueblo de Vilarín de Tresmonte desde el cual se regresa a Samartín.",Ruta,https://www.turismoasturias.es/descubre/naturaleza/rutas/senderismo/ruta-mina-carmina
Ruta Mirador de Ordiales,Cangas de Onís,43.22633201164836, -5.011429299623784,"['Distancia:11,2kms', 'Dificultad:Media', 'Código:PR223', 'Altitud:1.770 m.', 'Desnivel:641 m.', 'A pie:5 h. 40 min.Ida y vuelta', 'Punto de partida:Pandecarmen', 'Tipo de ruta:senderismo', 'Tipo de recorrido:Ida y vuelta', 'Trazado de la ruta:Descargar kml,Descargar gpx']","Roberto Frassinelli, ""El Alemán de Corao"", y, muy especialmente, don Pedro Pidal, marqués de Villaviciosa, son los dos grandes personajes que le dieron relevancia a esta zona de los Picos de Europa. En la ruta encontramos el Pozo del Alemán y culminamos en las mejores vistas, sobre la tumba de los restos del marqués.En el centenario de la creación del Parque Nacional, el primero de nuestro país, esta ruta sirve para rendir homenaje a quien lo hizo posible, don Pedro Pidal. Entre el lago Enol y el mirador encontraremos un mosaico de pastos, vegas de montaña y roca en el que ir ganando altura y con ello vistas a media Asturias y al mar.Tres son las construcciones que encontraremos: cabañas de pastores, corros para encerrar al ganado para vacunarlo, esquilarlo u ordeñarlo, y tendayos para guarecer el ganado de las tormentas o los carnívoros.Y al llegar al Mirador, el paraíso, con unas increíbles vistas hacia el valle de Angón, Amieva, Ponga y media Asturias. Los más avezados montañeros podrán, en unos 45 minutos, llegar a la cumbre del Cotalba y disfrutar aún más.",Ruta,https://www.turismoasturias.es/descubre/naturaleza/rutas/senderismo/ruta-mirador-de-ordiales
Ruta Naviega (Bao y Barayo - Navia),Navia,43.5587546404507, -6.66924416744201,"['Distancia:17kms', 'Dificultad:Media', 'Código:GR204 Senda Costera E9 - Etapa 24', 'Altitud:81 m.', 'Desnivel:566 m.', 'A pie:6 h. 30 min.Sólo ida', 'Punto de partida:Bao y Barayo', 'Tipo de ruta:senderismo', 'Tipo de recorrido:Travesía', 'Trazado de la ruta:Descargar kml']","Bao y Barayo - Navia17La ruta comienza en un bosque al este de las localidades de Bao y Barayo (Navia), desde donde transcurre una senda que nos lleva al Norte hacia la costa, bordeando la playa de Barayo por el Oeste y caminando toda la rasa costera hasta la playa de Navia, atravesando Puerto de Vega. Siempre que exista una bifurcación, tomaremos el camino de la derecha, salvo que implique la bajada a una playa.En los primeros 2,5 kilómetros de recorrido, dejamos a nuestra derecha la Reserva Natural Parcial de Barayo y seguimos la senda bordeando los acantilados de la costa.Caminados 4 kilómetros más desde el punto anterior, kilómetro 6,5, entramos en la localidad de Puerto de Vega. Deberemos atravesarla siguiendo lo más cerca posible la línea de la costa.Casi a mitad de nuestra ruta, kilómetro 8,3, a nuestra derecha hallamos la Losera, una playa de rocas moldeadas por el efecto erosivo del agua. Un poco más adelante, nos encontraremos la isla de Soirana.Y mil metros más adelante, aproximadamente, encontramos Puerto de Panes, estrecho brazo de mar flanqueado por sendos acantilados que casi parecen rozarse.Llevaremos andados unos 10,5 kilómetros desde el inicio de la ruta cuando llegamos al Monumento Natural de la playa de Frexulfe, que presenta un campo de dunas, fijado por un pinar, pobladas de diferentes especies naturales protegidas o en peligro de extinción.En el kilómetro 13,3, hacia nuestra derecha encontramos una pequeña playa cuyo arenal apenas es visible con la pleamar: es la playa naviega de Fabal. En su margen izquierda, situado sobre un promontorio, podemos ver el Castro de Fabal, probablemente de origen prerromano.A 3 kilómetros del punto anterior, a nuestra derecha hallamos la playa del Moro, que será la última parada antes de llegar a nuestro destino. Pocos metros después, llegamos a la playa de Navia, punto final de nuestra ruta. Al fondo de ésta podemos ver la ría del mismo nombre.",Ruta,https://www.turismoasturias.es/descubre/naturaleza/rutas/sendas-costeras/barayo-navia
Ruta Noreña a La Felguera de Noreña,Noreña,43.406945499592, -5.6921089952812,"['Distancia:5,3kms', 'Dificultad:Baja', 'Altitud:370 m.', 'Desnivel:179 m.', 'A pie:1 h. 30 min.Sólo ida', 'Punto de partida:Noreña', 'Tipo de ruta:Senderismo', 'Tipo de recorrido:Travesía', 'Trazado de la ruta:Descargar kml,Descargar gpx']","Si en Asturias hay un territorio singular, sin duda alguna que es Noreña. Villa Condal, único municipio con esta figura en la región, está dividido en cinco pequeños territorios dispersos dentro del concejo de Siero, en pleno centro de Asturias.Y esta ruta nos lleva, precisamente, desde esta señorial villa, por Espiniella y Celles/Ceis, hasta la Felguera de Noreña, el territorio más al norte del municipio, desde donde se dominan las vistas no sólo de Noreña, sino también de Siero y más allá.Es, sin duda, una ruta de paisajes, para contemplar el Aramo a lo lejos, para disfrutar a vista de pájaro de esta zona central asturiana perdiéndonos por mínimas carreterillas locales que nos llevan de la villa chacinera a las aldeas rurales entre pastos, vacas y matorrales, con fauna autóctona menuda y ratoneros que vigilan desde sus atalayas la aparición de pequeños roedores.Un paseo tranquilo para hacer a pie o en bicicleta acompañados de la familia.",Ruta,https://www.turismoasturias.es/descubre/naturaleza/rutas/senderismo/ruta-norena-espiniella-celles-la-felguera-de-norena
Ruta O Teixo - Os Teixóis,Taramundi,43.33432781806141, -7.070098000167845,"['Distancia:9,9kms', 'Dificultad:Baja', 'Código:PR102.1', 'Altitud:680 m.', 'Desnivel:665 m.', 'A pie:3 h. 35 min.', 'Punto de partida:Teixo', 'Tipo de ruta:senderismo', 'Tipo de recorrido:Circular', 'Trazado de la ruta:Descargar kml,Descargar gpx']","O Teixo - O Teixo9La ruta da comienzo en O Teixo (Taramundi), entre las cumbres del Ouroso y el Busnovo. En las inmediaciones del albergue se emprende el camino por la carretera que va hacia Santa Mariña. En las últimas casas de O Teixo se toma a la derecha una pista, hasta encontrar un cruce en el que cogemos el desvío de la izquierda y que discurre por debajo de la carretera. Cuando llegamos a un ‘castañéu', la pista se transforma en una senda que lo atraviesa hasta el pueblo de Santa Mariña, ejemplo de arquitectura rural del occidente asturiano, con los característicos volúmenes herméticos, muros de mampostería con piedra vista y cubierta de pizarra.Desde Santa Mariña continuamos por la carretera que sale a la derecha y se dirige hacia otro ejemplo de la arquitectura rural, y desde aquí nuestro camino se encarama en lo alto de las crestas donde encontramos una pista que continúa hacia la izquierda, entre una zona de brezales y, que nos conduce hacia el caserío de Os Armallos.Aquí el camino gira a la derecha, para descender entre prados y castañales hasta la carretera que une Taramundi con As Veigas, y desde ésta por un sendero hacia el conjunto etnográfico de Os Teixóis, perfecto ejemplo de lo que en el siglo XVIII fue una próspera industria en todo el Occidente de Asturias. Os Teixóis reúne toda una serie de ingenios movidos por agua: un molino, el mazo de una ferrería, un batán para el tratamiento de la lana, piedras de afilar y una primitiva central eléctrica.Una vez visitado el conjunto, nos dirigimos hacia la cercana aldea de As Mestas por un sendero que transcurre al lado del arroyo. Ignoramos los cuatro primeros cruces que encontramos, para posteriormente coger el siguiente a la derecha, que nos conducirá a una pista que tomamos a la derecha.Por el camino encontraremos las aún identificables ‘carboeiras' que, alimentadas con el abundante roble de la zona, producían el carbón vegetal consumido en las antaño numerosas ferrerías. Una vez en As Mestas tomamos la pista que lo une con O Teixo.",Ruta,https://www.turismoasturias.es/descubre/naturaleza/rutas/senderismo/ruta-teixo-teixois
Ruta Olloniego a Soto de Rey,Oviedo y Ribera de Arriba,43.29611746610491, -5.836327657875586,"['Distancia:4,6kms', 'Dificultad:Baja', 'Código:PR240', 'Altitud:129 m.', 'Desnivel:88 m.', 'A pie:1 h.Sólo ida', 'Punto de partida:Olloniego/Lluniego', 'Tipo de ruta:Senderismo', 'Tipo de recorrido:Lineal', 'Trazado de la ruta:Descargar kml,Descargar gpx']","Por increíble que parezca entre dos zonas industriales y cerca de Oviedo, la naturaleza se abre paso junto al río Nalón a lo largo de todo este recorrido. El río es el eje principal en torno al que gira todo, la flora, la fauna e incluso las rocas.Estamos en una zona de roca caliza en la que encontramos dos escuelas de escalada: la de Manzaneda, más arriba de Olloniego, y la de los Navalones, en plena ruta, en la zona más estrecha del paso del río en el que éste ha excavado la roca abriendo este acceso.En el río, alisos, arces y chopos se encargan de estabilizar el cauce, y dentro de él, ánades reales, gallinetas y fochas son fáciles de divisar nadando en medio del cauce o semiescondidos entre los cañaverales.Un precioso y sencillo paseo por una pista para bicicletas que podremos hacer caminando o pedaleando al lado de la ciudad, para desestresarnos del ritmo de ésta.",Ruta,https://www.turismoasturias.es/descubre/naturaleza/rutas/senderismo/ruta-olloniego-soto-del-rey
Ruta Orillés a Campa Espines,Aller y Laviana,43.18556040150838, -5.636860494714774,"['Distancia:10kms', 'Dificultad:Media', 'Código:PR205', 'Altitud:1.030 m.', 'Desnivel:150 m.', 'A pie:3 h.Sólo ida', 'Punto de partida:Uriés', 'Tipo de ruta:senderismo', 'Tipo de recorrido:Ida y vuelta', 'Trazado de la ruta:Descargar kml,Descargar gpx']",No se puede hacer con carrito/silla bebé. Se puede hacer con bici de montaña (dificultad media-alta).,Ruta,https://www.turismoasturias.es/descubre/naturaleza/rutas/senderismo/ruta-orilles-campa-espines
Ruta Peña Cabrera,Cabranes,43.42704496560752, -5.412307052823532,"['Distancia:5kms', 'Dificultad:Media', 'Código:PR52', 'Altitud:492 m.', 'Desnivel:233 m.', 'A pie:4 h. Ida y vuelta', 'Punto de partida:Santolaya', 'Tipo de ruta:Senderismo', 'Tipo de recorrido:Ida y vuelta', 'Trazado de la ruta:Descargar kml,Descargar gpx']","Entre el mar y la montaña, entre Villaviciosa y Piloña, partiendo de Santolaya encontramos este recorrido que mira a ambos lados y que discurre por una red de senderos y caminos carreteros entre fincas, plantaciones de eucalipto y bosquetes de robles.Tras la ascensión inicial, nos desplazamos por la cresta de la loma situada entre los valles de los ríos Viacaba y Profundo, con paisajes abiertos a los dos. La zona elevada por la que nos movemos nos acerca todos los sonidos propios de la actividad diaria de estas pequeñas parroquias y de su entorno, como el cortar leña, la siega de los prados a máquina, tractores, perros... todos ellos en la lejanía, pero dando más color si cabe a nuestro paisaje.Desde el área recreativa de Peña Cabrera, nuestro objetivo inicial, tenemos una vista privilegiada de Villaviciosa y de su ría. Aquí podemos descansar antes de dar la vuelta sobre nuestros pasos. Aún tenemos otra opción: bajar por la carretera hasta Viñón y retornar por el camino del río Viacaba, pasando por el Museo de la Escuela Rural de Viñón.",Ruta,https://www.turismoasturias.es/descubre/naturaleza/rutas/senderismo/ruta-pena-cabrera
Ruta Peña Villa desde Molledo,Siero y Langreo,43.34908285113025, -5.700124321317952,"['Distancia:9,8kms', 'Dificultad:Media', 'Altitud:589 m.', 'Desnivel:206 m.', 'A pie:3 h. Ida y vuelta', 'Punto de partida:Molleo (Siero)', 'Tipo de ruta:Senderismo', 'Tipo de recorrido:Ida y vuelta', 'Trazado de la ruta:Descargar kml,Descargar gpx']","En la Asturias central, cercana a la Autovía Minera en territorio de Siero, se encuentra Molleo, un pueblecito tranquilo desde el que podemos darnos un paseo por caminos y pequeñas carreteras hasta Peña Villa.Avellanos, fresnos y algún que otro majuelo nos guían por el sendero entre verdes prados hasta el primer hito de nuestro camino, la escuela de escalada de Molledo-La Bobia, desde donde disfrutar de las vistas del valle por el que sube la Autovía Minera.Desde aquí, entre huertos donde podemos ver aún a algunos lugareños ""cuchando"" (repartir estiércol en las fincas para abonarlas), entre fincas, abedules, olmos y robles nos vamos acercando poco a poco a Peña Villa, a la que subimos primero por pastos y después entre tojales, con el acompañamiento de algún macho de tarabilla común trinando desde lo alto de los tojos.Al llegar a la cumbre hallamos un mundo de contrastes: el paisaje rural que veníamos viendo por el este de Peña Villa se convierte en industrial al Sur, al ver desde el aire el Valle del Nalón, y en urbano al Noroeste, que es por donde se extiende Oviedo/Uviéu bajo nuestra vista. Una ruta para descubrir esta zona central de Asturias.",Ruta,https://www.turismoasturias.es/descubre/naturaleza/rutas/senderismo/pena-villa-desde-molleo
